{
  "workflowVersion": "2.0",
  "configurationVersion": "2.0",
  "vocabulary": {
    "lifecycle": ["TODO", "IN_PROGRESS", "MERGED", "DEV_DEPLOYED", "CANCELLED", "SUPERSEDED"],
    "prLifecycle": ["NONE", "DRAFT", "READY_FOR_REVIEW", "MERGED", "CLOSED"],
    "reviewStatus": ["NOT_REQUESTED", "PENDING", "CHANGES_REQUESTED", "APPROVED", "STALE", "HISTORICAL_UNVERIFIED", "NOT_APPLICABLE"],
    "stage": ["READINESS_CHECK", "IMPACT_ANALYSIS", "PLANNING", "PLAN_REVIEW", "IMPLEMENTATION", "LOCAL_VALIDATION", "PRE_REVIEW_CHECK", "PR_REVIEW", "FINAL_CI", "PROMOTION", "DEPLOYMENT", "DEV_VALIDATION", "SPRINT_INTEGRATION", "QA", "BLOCKED"],
    "acceptanceVerificationStage": ["PRE_MERGE", "DEVELOPMENT", "SPRINT_INTEGRATION", "QA"],
    "gateStatus": ["PENDING", "PASS", "FAIL", "NOT_APPLICABLE", "STALE", "HISTORICAL_UNVERIFIED", "BLOCKED"],
    "blockerStatus": ["OPEN", "RESOLVED", "HUMAN_DECISION_REQUIRED"]
  },
  "branchPromotion": [
    { "from": "feature/*", "to": "development", "environment": "development" },
    { "from": "development", "to": "test", "environment": "test" },
    { "from": "test", "to": "master", "environment": "production" }
  ],
  "canonicalCommands": {
    "contracts": "Invoke-Pester ops/tests/SprintDelivery.Tests.ps1 -Tag contracts",
    "workflowTests": "pwsh -File ops/Test-SprintDelivery.ps1",
    "reconcile": "pwsh -File ops/Invoke-SprintDelivery.ps1 -Reconcile -WhatIf",
    "restore": "dotnet restore CloudOrders.slnx",
    "format": "dotnet format CloudOrders.slnx --verify-no-changes --no-restore"
  },
  "requiredGatesByRisk": {
    "low": ["codeReview", "ci", "devValidation"],
    "standard": ["codeReview", "ci", "devValidation", "independentReview"],
    "high": ["codeReview", "ci", "devValidation", "independentReview", "qaValidation"]
  },
  "modelRoles": {
    "default_model": "logical-default-reasoning-role",
    "strong_model": "logical-escalation-review-role"
  },
  "retryLimits": {
    "command": 2,
    "deployment": 1,
    "requiresDistinctHypothesis": true
  },
  "humanDecisionStatus": "HUMAN_DECISION_REQUIRED"
}
